util/visualize/yolov5s_verbose.txt
[TensorRT] VERBOSE: *************** Autotuning format combination: Float(1,640,409600,1228800) -> Float(1,320,102400,1228800) ***************
[TensorRT] VERBOSE: --------------- Timing Runner: (Unnamed Layer* 0) [Slice] (Slice)
[TensorRT] VERBOSE: Tactic: 0 is the only option, timing skipped
[TensorRT] VERBOSE: Fastest Tactic: 0 Time: 0
[TensorRT] VERBOSE: --------------- Timing Runner: <reformat> (Reformat)
[TensorRT] VERBOSE: Tactic: 1002 time 0.0312
[TensorRT] VERBOSE: Tactic: 0 time 0.01072
[TensorRT] VERBOSE: Fastest Tactic: 0 Time: 0.01072
[TensorRT] VERBOSE: *************** Autotuning format combination: Float(1,640,409600,1228800) -> Float(1,320,102400,1228800) ***************
[TensorRT] VERBOSE: --------------- Timing Runner: (Unnamed Layer* 1) [Slice] (Slice)
[TensorRT] VERBOSE: Tactic: 0 is the only option, timing skipped
[TensorRT] VERBOSE: Fastest Tactic: 0 Time: 0
[TensorRT] VERBOSE: *************** Autotuning format combination: Float(1,640,409600,1228800) -> Float(1,320,102400,1228800) ***************
[TensorRT] VERBOSE: --------------- Timing Runner: (Unnamed Layer* 2) [Slice] (Slice)
[TensorRT] VERBOSE: Tactic: 0 is the only option, timing skipped
[TensorRT] VERBOSE: Fastest Tactic: 0 Time: 0
[TensorRT] VERBOSE: *************** Autotuning format combination: Float(1,640,409600,1228800) -> Float(1,320,102400,1228800) ***************
[TensorRT] VERBOSE: --------------- Timing Runner: (Unnamed Layer* 3) [Slice] (Slice)
[TensorRT] VERBOSE: Tactic: 0 is the only option, timing skipped
[TensorRT] VERBOSE: Fastest Tactic: 0 Time: 0
[TensorRT] VERBOSE: --------------- Timing Runner: <reformat> (Reformat)
[TensorRT] VERBOSE: Tactic: 1002 time 0.039456
[TensorRT] VERBOSE: Tactic: 0 time 0.027136
[TensorRT] VERBOSE: Fastest Tactic: 0 Time: 0.027136
[TensorRT] VERBOSE: --------------- Timing Runner: <reformat> (Reformat)
[TensorRT] VERBOSE: Tactic: 1002 time 0.036896
[TensorRT] VERBOSE: Tactic: 0 time 0.03248
[TensorRT] VERBOSE: Fastest Tactic: 0 Time: 0.03248
[TensorRT] VERBOSE: *************** Autotuning format combination: Float(1,320,102400,1228800) -> Float(1,320,102400,3276800) ***************
[TensorRT] VERBOSE: (Unnamed Layer* 5) [Convolution] (scudnn) Set Tactic Name: volta_scudnn_128x128_relu_medium_nn_v1
[TensorRT] VERBOSE: (Unnamed Layer* 5) [Convolution] (scudnn_winograd) Set Tactic Name: volta_scudnn_winograd_128x128_ldg1_ldg4_relu_tile148t_nt_v1
[TensorRT] VERBOSE: (Unnamed Layer* 5) [Convolution] (scudnn) Set Tactic Name: volta_scudnn_128x64_relu_xregs_large_nn_v1
[TensorRT] VERBOSE: (Unnamed Layer* 5) [Convolution] (scudnn) Set Tactic Name: volta_scudnn_128x128_relu_small_nn_v1
[TensorRT] VERBOSE: (Unnamed Layer* 5) [Convolution] (scudnn) Set Tactic Name: volta_scudnn_128x128_relu_xregs_large_nn_v1
[TensorRT] VERBOSE: (Unnamed Layer* 5) [Convolution] (scudnn) Set Tactic Name: volta_scudnn_128x64_relu_small_nn_v1
[TensorRT] VERBOSE: (Unnamed Layer* 5) [Convolution] (scudnn) Set Tactic Name: volta_scudnn_128x64_relu_medium_nn_v1
[TensorRT] VERBOSE: (Unnamed Layer* 5) [Convolution] (scudnn) Set Tactic Name: volta_scudnn_128x32_relu_medium_nn_v1
[TensorRT] VERBOSE: (Unnamed Layer* 5) [Convolution] (scudnn) Set Tactic Name: volta_scudnn_128x32_relu_small_nn_v1
[TensorRT] VERBOSE: --------------- Timing Runner: (Unnamed Layer* 5) [Convolution] (FusedConvActConvolution)
[TensorRT] VERBOSE: Tactic: 524287 time 0.188896
[TensorRT] VERBOSE: Tactic: 720895 time 0.180224
[TensorRT] VERBOSE: Tactic: 983039 time 0.182944
[TensorRT] VERBOSE: Tactic: 1048575 time 0.183296
[TensorRT] VERBOSE: Tactic: 1703935 time 0.182752
[TensorRT] VERBOSE: Tactic: 1966079 time 0.190944
[TensorRT] VERBOSE: Tactic: 2031615 time 0.192512
[TensorRT] VERBOSE: Tactic: 2228223 time 0.183872
[TensorRT] VERBOSE: Tactic: 2752511 time 0.178176
[TensorRT] VERBOSE: Tactic: 2818047 time 0.32848
[TensorRT] VERBOSE: Tactic: 2883583 time 0.304928
[TensorRT] VERBOSE: Tactic: 3014655 time 0.180928
[TensorRT] VERBOSE: Tactic: 3145727 time 0.174112
[TensorRT] VERBOSE: Tactic: 3473407 time 0.298656
[TensorRT] VERBOSE: Tactic: 3604479 time 0.180672
[TensorRT] VERBOSE: Tactic: 3735551 time 0.29232
[TensorRT] VERBOSE: Tactic: 4390911 time 0.204256
[TensorRT] VERBOSE: Tactic: 5046271 time 0.18192
[TensorRT] VERBOSE: Tactic: 5963775 time 0.190624
[TensorRT] VERBOSE: Tactic: 6160383 time 0.188896
[TensorRT] VERBOSE: Tactic: 6488063 time 0.182144
[TensorRT] VERBOSE: Tactic: 6881279 time 0.197088
[TensorRT] VERBOSE: Tactic: 7995391 time 0.17568
[TensorRT] VERBOSE: Tactic: 8585215 time 0.186816
[TensorRT] VERBOSE: Tactic: 8978431 time 0.190944
[TensorRT] VERBOSE: Tactic: 9043967 time 0.180224
[TensorRT] VERBOSE: Tactic: 9175039 time 0.180704
[TensorRT] VERBOSE: Tactic: 9502719 time 0.192224
[TensorRT] VERBOSE: Tactic: 9830399 time 0.288768
[TensorRT] VERBOSE: Tactic: 10027007 time 0.182272
[TensorRT] VERBOSE: Tactic: 10092543 time 0.203552
[TensorRT] VERBOSE: Tactic: 10289151 time 0.191168
[TensorRT] VERBOSE: Tactic: 10485759 time 0.180544
[TensorRT] VERBOSE: Tactic: 10813439 time 0.17248
[TensorRT] VERBOSE: Fastest Tactic: 10813439 Time: 0.17248
[TensorRT] VERBOSE: --------------- Timing Runner: (Unnamed Layer* 5) [Convolution] (CaskConvolution)
[TensorRT] VERBOSE: (Unnamed Layer* 5) [Convolution] (scudnn) Set Tactic Name: volta_scudnn_128x128_relu_medium_nn_v1
[TensorRT] VERBOSE: Tactic: 1825138533642645384 time 0.293344
[TensorRT] VERBOSE: (Unnamed Layer* 5) [Convolution] (scudnn_winograd) Set Tactic Name: volta_scudnn_winograd_128x128_ldg1_ldg4_relu_tile148t_nt_v1
[TensorRT] VERBOSE: Tactic: 2775507031594384867 time 0.121504
[TensorRT] VERBOSE: (Unnamed Layer* 5) [Convolution] (scudnn) Set Tactic Name: volta_scudnn_128x64_relu_xregs_large_nn_v1
[TensorRT] VERBOSE: Tactic: 2842488832350522458 time 0.157696
[TensorRT] VERBOSE: (Unnamed Layer* 5) [Convolution] (scudnn) Set Tactic Name: volta_scudnn_128x128_relu_small_nn_v1
[TensorRT] VERBOSE: Tactic: 3915320020053085238 time 0.292864
[TensorRT] VERBOSE: (Unnamed Layer* 5) [Convolution] (scudnn) Set Tactic Name: volta_scudnn_128x128_relu_xregs_large_nn_v1
[TensorRT] VERBOSE: Tactic: 6448355332020552203 time 0.352704
[TensorRT] VERBOSE: (Unnamed Layer* 5) [Convolution] (scudnn) Set Tactic Name: volta_scudnn_128x64_relu_small_nn_v1
[TensorRT] VERBOSE: Tactic: 6808617066150061604 time 0.157696
[TensorRT] VERBOSE: (Unnamed Layer* 5) [Convolution] (scudnn) Set Tactic Name: volta_scudnn_128x64_relu_medium_nn_v1
[TensorRT] VERBOSE: Tactic: -8060443123034038864 time 0.159232
[TensorRT] VERBOSE: (Unnamed Layer* 5) [Convolution] (scudnn) Set Tactic Name: volta_scudnn_128x32_relu_medium_nn_v1
[TensorRT] VERBOSE: Tactic: -4420849921117327522 time 0.10304
[TensorRT] VERBOSE: (Unnamed Layer* 5) [Convolution] (scudnn) Set Tactic Name: volta_scudnn_128x32_relu_small_nn_v1
[TensorRT] VERBOSE: Tactic: -3946921629105938337 time 0.094048
[TensorRT] VERBOSE: Fastest Tactic: -3946921629105938337 Time: 0.094048
[TensorRT] VERBOSE: --------------- Timing Runner: (Unnamed Layer* 5) [Convolution] (CudaConvolution)
[TensorRT] VERBOSE: Tactic: 0 time 0.223584
[TensorRT] VERBOSE: Tactic: 1 time 0.145408
[TensorRT] VERBOSE: Tactic: 2 skipped. Scratch requested: 44236800, available: 20971520
[TensorRT] VERBOSE: Tactic: 5 time 2.17722
[TensorRT] VERBOSE: Tactic: 6 time 0.176032
[TensorRT] VERBOSE: Tactic: 56 time 0.223104
[TensorRT] VERBOSE: Tactic: 57 time 0.145888
[TensorRT] VERBOSE: Tactic: 58 skipped. Scratch requested: 44236800, available: 20971520
[TensorRT] VERBOSE: Tactic: 61 time 2.17971
[TensorRT] VERBOSE: Tactic: 62 time 0.176128
[TensorRT] INFO: Some tactics do not have sufficient workspace memory to run. Increasing workspace size may increase performance, please check verbose output.
[TensorRT] VERBOSE: Fastest Tactic: 1 Time: 0.145408
[TensorRT] VERBOSE: --------------- Timing Runner: (Unnamed Layer* 5) [Convolution] (CudaDepthwiseConvolution)
[TensorRT] VERBOSE: CudaDepthwiseConvolution has no valid tactics for this config, skipping
[TensorRT] VERBOSE: --------------- Timing Runner: (Unnamed Layer* 5) [Convolution] (CublasConvolution)
[TensorRT] VERBOSE: CublasConvolution has no valid tactics for this config, skipping
[TensorRT] VERBOSE: >>>>>>>>>>>>>>> Chose Runner Type: CaskConvolution Tactic: -3946921629105938337
[TensorRT] VERBOSE: (Unnamed Layer* 5) [Convolution] (scudnn) Set Tactic Name: volta_scudnn_128x32_relu_small_nn_v1
[TensorRT] VERBOSE: 
[TensorRT] VERBOSE: (Unnamed Layer* 5) [Convolution] (scudnn) Set Tactic Name: volta_scudnn_128x128_relu_medium_nn_v1
[TensorRT] VERBOSE: (Unnamed Layer* 5) [Convolution] (scudnn_winograd) Set Tactic Name: volta_scudnn_winograd_128x128_ldg1_ldg4_relu_tile148t_nt_v1
[TensorRT] VERBOSE: (Unnamed Layer* 5) [Convolution] (scudnn) Set Tactic Name: volta_scudnn_128x64_relu_xregs_large_nn_v1
[TensorRT] VERBOSE: (Unnamed Layer* 5) [Convolution] (scudnn) Set Tactic Name: volta_scudnn_128x128_relu_small_nn_v1
[TensorRT] VERBOSE: (Unnamed Layer* 5) [Convolution] (scudnn) Set Tactic Name: volta_scudnn_128x128_relu_xregs_large_nn_v1
[TensorRT] VERBOSE: (Unnamed Layer* 5) [Convolution] (scudnn) Set Tactic Name: volta_scudnn_128x64_relu_small_nn_v1
[TensorRT] VERBOSE: (Unnamed Layer* 5) [Convolution] (scudnn) Set Tactic Name: volta_scudnn_128x64_relu_medium_nn_v1
[TensorRT] VERBOSE: (Unnamed Layer* 5) [Convolution] (scudnn) Set Tactic Name: volta_scudnn_128x32_relu_medium_nn_v1
[TensorRT] VERBOSE: (Unnamed Layer* 5) [Convolution] (scudnn) Set Tactic Name: volta_scudnn_128x32_relu_small_nn_v1
[TensorRT] VERBOSE: (Unnamed Layer* 5) [Convolution] (scudnn) Set Tactic Name: volta_scudnn_128x32_relu_small_nn_v1
[TensorRT] VERBOSE: *************** Autotuning format combination: Float(12,3840,1,1228800) -> Float(32,10240,1,3276800) ***************
[TensorRT] VERBOSE: (Unnamed Layer* 5) [Convolution] (scudnn) Set Tactic Name: volta_scudnn_128x128_relu_exp_medium_nhwc_tn_v1
[TensorRT] VERBOSE: (Unnamed Layer* 5) [Convolution] (scudnn) Set Tactic Name: volta_scudnn_128x128_ldg4_relu_exp_large_nhwc_tn_v1
[TensorRT] VERBOSE: (Unnamed Layer* 5) [Convolution] (scudnn) Set Tactic Name: volta_scudnn_128x64_sliced1x2_ldg4_relu_exp_small_nhwc_tn_v1
[TensorRT] VERBOSE: (Unnamed Layer* 5) [Convolution] (scudnn) Set Tactic Name: volta_scudnn_128x128_relu_exp_small_nhwc_tn_v1
[TensorRT] VERBOSE: (Unnamed Layer* 5) [Convolution] (scudnn) Set Tactic Name: volta_scudnn_128x32_sliced1x4_ldg4_relu_exp_small_nhwc_tn_v1
[TensorRT] VERBOSE: (Unnamed Layer* 5) [Convolution] (scudnn) Set Tactic Name: volta_scudnn_128x128_ldg4_relu_exp_medium_nhwc_tn_v1
[TensorRT] VERBOSE: (Unnamed Layer* 5) [Convolution] (scudnn) Set Tactic Name: volta_scudnn_128x64_sliced1x2_ldg4_relu_exp_medium_nhwc_tn_v1
[TensorRT] VERBOSE: (Unnamed Layer* 5) [Convolution] (scudnn) Set Tactic Name: volta_scudnn_128x128_ldg4_relu_exp_small_nhwc_tn_v1
[TensorRT] VERBOSE: (Unnamed Layer* 5) [Convolution] (scudnn) Set Tactic Name: volta_scudnn_128x128_relu_exp_large_nhwc_tn_v1
[TensorRT] VERBOSE: (Unnamed Layer* 5) [Convolution] (scudnn) Set Tactic Name: volta_scudnn_128x64_sliced1x2_ldg4_relu_exp_large_nhwc_tn_v1
[TensorRT] VERBOSE: (Unnamed Layer* 5) [Convolution] (scudnn) Set Tactic Name: volta_scudnn_128x32_sliced1x4_ldg4_relu_exp_medium_nhwc_tn_v1
[TensorRT] VERBOSE: --------------- Timing Runner: (Unnamed Layer* 5) [Convolution] (FusedConvActConvolution)
[TensorRT] VERBOSE: FusedConvActConvolution has no valid tactics for this config, skipping
[TensorRT] VERBOSE: --------------- Timing Runner: (Unnamed Layer* 5) [Convolution] (CaskConvolution)
[TensorRT] VERBOSE: (Unnamed Layer* 5) [Convolution] (scudnn) Set Tactic Name: volta_scudnn_128x128_relu_exp_medium_nhwc_tn_v1
[TensorRT] VERBOSE: Tactic: 861694390046228376 time 0.36272
[TensorRT] VERBOSE: (Unnamed Layer* 5) [Convolution] (scudnn) Set Tactic Name: volta_scudnn_128x128_ldg4_relu_exp_large_nhwc_tn_v1
[TensorRT] VERBOSE: Tactic: 1017870653102653567 time 0.36032
[TensorRT] VERBOSE: (Unnamed Layer* 5) [Convolution] (scudnn) Set Tactic Name: volta_scudnn_128x64_sliced1x2_ldg4_relu_exp_small_nhwc_tn_v1
[TensorRT] VERBOSE: Tactic: 5258189349241541167 time 0.206848
[TensorRT] VERBOSE: (Unnamed Layer* 5) [Convolution] (scudnn) Set Tactic Name: volta_scudnn_128x128_relu_exp_small_nhwc_tn_v1
[TensorRT] VERBOSE: Tactic: 5821621277990374316 time 0.364
[TensorRT] VERBOSE: (Unnamed Layer* 5) [Convolution] (scudnn) Set Tactic Name: volta_scudnn_128x32_sliced1x4_ldg4_relu_exp_small_nhwc_tn_v1
[TensorRT] VERBOSE: Tactic: 5863767799113001648 time 0.264384
[TensorRT] VERBOSE: (Unnamed Layer* 5) [Convolution] (scudnn) Set Tactic Name: volta_scudnn_128x128_ldg4_relu_exp_medium_nhwc_tn_v1
[TensorRT] VERBOSE: Tactic: -9147980667639709536 time 0.359968
[TensorRT] VERBOSE: (Unnamed Layer* 5) [Convolution] (scudnn) Set Tactic Name: volta_scudnn_128x64_sliced1x2_ldg4_relu_exp_medium_nhwc_tn_v1
[TensorRT] VERBOSE: Tactic: -8850904373104590857 time 0.207104
[TensorRT] VERBOSE: (Unnamed Layer* 5) [Convolution] (scudnn) Set Tactic Name: volta_scudnn_128x128_ldg4_relu_exp_small_nhwc_tn_v1
[TensorRT] VERBOSE: Tactic: -7751035352149795660 time 0.36
[TensorRT] VERBOSE: (Unnamed Layer* 5) [Convolution] (scudnn) Set Tactic Name: volta_scudnn_128x128_relu_exp_large_nhwc_tn_v1
[TensorRT] VERBOSE: Tactic: -3853827649136781465 time 0.365056
[TensorRT] VERBOSE: (Unnamed Layer* 5) [Convolution] (scudnn) Set Tactic Name: volta_scudnn_128x64_sliced1x2_ldg4_relu_exp_large_nhwc_tn_v1
[TensorRT] VERBOSE: Tactic: -3263369460438823196 time 0.20528
[TensorRT] VERBOSE: (Unnamed Layer* 5) [Convolution] (scudnn) Set Tactic Name: volta_scudnn_128x32_sliced1x4_ldg4_relu_exp_medium_nhwc_tn_v1
[TensorRT] VERBOSE: Tactic: -423878181466897819 time 0.264512
[TensorRT] VERBOSE: Fastest Tactic: -3263369460438823196 Time: 0.20528
[TensorRT] VERBOSE: --------------- Timing Runner: (Unnamed Layer* 5) [Convolution] (CudaConvolution)
[TensorRT] VERBOSE: CudaConvolution has no valid tactics for this config, skipping
[TensorRT] VERBOSE: --------------- Timing Runner: (Unnamed Layer* 5) [Convolution] (CudaDepthwiseConvolution)
[TensorRT] VERBOSE: CudaDepthwiseConvolution has no valid tactics for this config, skipping
[TensorRT] VERBOSE: --------------- Timing Runner: (Unnamed Layer* 5) [Convolution] (CublasConvolution)
[TensorRT] VERBOSE: CublasConvolution has no valid tactics for this config, skipping
[TensorRT] VERBOSE: >>>>>>>>>>>>>>> Chose Runner Type: CaskConvolution Tactic: -3263369460438823196
[TensorRT] VERBOSE: (Unnamed Layer* 5) [Convolution] (scudnn) Set Tactic Name: volta_scudnn_128x64_sliced1x2_ldg4_relu_exp_large_nhwc_tn_v1
[TensorRT] VERBOSE: 
[TensorRT] VERBOSE: (Unnamed Layer* 5) [Convolution] (scudnn) Set Tactic Name: volta_scudnn_128x128_relu_exp_medium_nhwc_tn_v1
[TensorRT] VERBOSE: (Unnamed Layer* 5) [Convolution] (scudnn) Set Tactic Name: volta_scudnn_128x128_ldg4_relu_exp_large_nhwc_tn_v1
[TensorRT] VERBOSE: (Unnamed Layer* 5) [Convolution] (scudnn) Set Tactic Name: volta_scudnn_128x64_sliced1x2_ldg4_relu_exp_small_nhwc_tn_v1
[TensorRT] VERBOSE: (Unnamed Layer* 5) [Convolution] (scudnn) Set Tactic Name: volta_scudnn_128x128_relu_exp_small_nhwc_tn_v1
[TensorRT] VERBOSE: (Unnamed Layer* 5) [Convolution] (scudnn) Set Tactic Name: volta_scudnn_128x32_sliced1x4_ldg4_relu_exp_small_nhwc_tn_v1
[TensorRT] VERBOSE: (Unnamed Layer* 5) [Convolution] (scudnn) Set Tactic Name: volta_scudnn_128x128_ldg4_relu_exp_medium_nhwc_tn_v1
[TensorRT] VERBOSE: (Unnamed Layer* 5) [Convolution] (scudnn) Set Tactic Name: volta_scudnn_128x64_sliced1x2_ldg4_relu_exp_medium_nhwc_tn_v1
[TensorRT] VERBOSE: (Unnamed Layer* 5) [Convolution] (scudnn) Set Tactic Name: volta_scudnn_128x128_ldg4_relu_exp_small_nhwc_tn_v1
[TensorRT] VERBOSE: (Unnamed Layer* 5) [Convolution] (scudnn) Set Tactic Name: volta_scudnn_128x128_relu_exp_large_nhwc_tn_v1
[TensorRT] VERBOSE: (Unnamed Layer* 5) [Convolution] (scudnn) Set Tactic Name: volta_scudnn_128x64_sliced1x2_ldg4_relu_exp_large_nhwc_tn_v1
[TensorRT] VERBOSE: (Unnamed Layer* 5) [Convolution] (scudnn) Set Tactic Name: volta_scudnn_128x32_sliced1x4_ldg4_relu_exp_medium_nhwc_tn_v1
[TensorRT] VERBOSE: (Unnamed Layer* 5) [Convolution] (scudnn) Set Tactic Name: volta_scudnn_128x64_sliced1x2_ldg4_relu_exp_large_nhwc_tn_v1
[TensorRT] VERBOSE: --------------- Timing Runner: <reformat> (Reformat)
[TensorRT] VERBOSE: Tactic: 1002 time 0.055712
[TensorRT] VERBOSE: Tactic: 0 time 0.08224
[TensorRT] VERBOSE: Fastest Tactic: 1002 Time: 0.055712
[TensorRT] VERBOSE: --------------- Timing Runner: <reformat> (Reformat)
[TensorRT] VERBOSE: Tactic: 1002 time 0.079136
[TensorRT] VERBOSE: Tactic: 0 time 0.94208
[TensorRT] VERBOSE: Fastest Tactic: 1002 Time: 0.079136
[TensorRT] VERBOSE: --------------- Timing Runner: <reformat> (Reformat)
[TensorRT] VERBOSE: Tactic: 1002 time 0.063904
[TensorRT] VERBOSE: Tactic: 0 time 0.41776
[TensorRT] VERBOSE: Fastest Tactic: 1002 Time: 0.063904
[TensorRT] VERBOSE: --------------- Timing Runner: <reformat> (Reformat)
[TensorRT] VERBOSE: Tactic: 1002 time 0.098816
[TensorRT] VERBOSE: Tactic: 0 time 1.3527
[TensorRT] VERBOSE: Fastest Tactic: 1002 Time: 0.098816
[TensorRT] VERBOSE: --------------- Timing Runner: <reformat> (Reformat)
[TensorRT] VERBOSE: Tactic: 1002 time 0.320288
[TensorRT] VERBOSE: Tactic: 0 time 0.416256
[TensorRT] VERBOSE: Fastest Tactic: 1002 Time: 0.320288
[TensorRT] VERBOSE: --------------- Timing Runner: <reformat> (Reformat)
[TensorRT] VERBOSE: Tactic: 1002 time 0.098656
[TensorRT] VERBOSE: Tactic: 0 time 0.059904
[TensorRT] VERBOSE: Fastest Tactic: 0 Time: 0.059904
[TensorRT] VERBOSE: *************** Autotuning format combination: Float(1,320,102400,3276800) -> Float(1,320,102400,3276800) ***************
[TensorRT] VERBOSE: --------------- Timing Runner: PWN((Unnamed Layer* 7) [Activation], (Unnamed Layer* 8) [ElementWise]) (PointWise)
[TensorRT] VERBOSE: Tactic: 128 time 0.077792
[TensorRT] VERBOSE: Tactic: 256 time 0.079648
[TensorRT] VERBOSE: Tactic: 512 time 0.088768
[TensorRT] VERBOSE: Tactic: -32 time 0.118912
[TensorRT] VERBOSE: Tactic: -64 time 0.080384
[TensorRT] VERBOSE: Tactic: -128 time 0.078336
[TensorRT] VERBOSE: Fastest Tactic: 128 Time: 0.077792
[TensorRT] VERBOSE: --------------- Timing Runner: PWN((Unnamed Layer* 7) [Activation], (Unnamed Layer* 8) [ElementWise]) (PointWiseV2)
[TensorRT] VERBOSE: Tactic: 0 time 0.053248
[TensorRT] VERBOSE: Tactic: 1 time 0.05168
[TensorRT] VERBOSE: Tactic: 2 time 0.05168
[TensorRT] VERBOSE: Tactic: 3 time 0.05168
[TensorRT] VERBOSE: Tactic: 4 time 0.051712
[TensorRT] VERBOSE: Tactic: 5 time 0.05152
[TensorRT] VERBOSE: Tactic: 6 time 0.053248
[TensorRT] VERBOSE: Tactic: 7 time 0.05168
[TensorRT] VERBOSE: Tactic: 8 time 0.053568
[TensorRT] VERBOSE: Tactic: 9 time 0.052384
[TensorRT] VERBOSE: Tactic: 28 time 0.053248
[TensorRT] VERBOSE: Fastest Tactic: 5 Time: 0.05152
[TensorRT] VERBOSE: >>>>>>>>>>>>>>> Chose Runner Type: PointWiseV2 Tactic: 5
[TensorRT] VERBOSE: 
[TensorRT] VERBOSE: *************** Autotuning format combination: Float(32,10240,1,3276800) -> Float(32,10240,1,3276800) ***************
[TensorRT] VERBOSE: --------------- Timing Runner: PWN((Unnamed Layer* 7) [Activation], (Unnamed Layer* 8) [ElementWise]) (PointWise)
[TensorRT] VERBOSE: Tactic: 128 time 0.077824
[TensorRT] VERBOSE: Tactic: 256 time 0.079776
[TensorRT] VERBOSE: Tactic: 512 time 0.088512
[TensorRT] VERBOSE: Tactic: -32 time 0.119264
[TensorRT] VERBOSE: Tactic: -64 time 0.080352
[TensorRT] VERBOSE: Tactic: -128 time 0.078336
[TensorRT] VERBOSE: Fastest Tactic: 128 Time: 0.077824
[TensorRT] VERBOSE: --------------- Timing Runner: PWN((Unnamed Layer* 7) [Activation], (Unnamed Layer* 8) [ElementWise]) (PointWiseV2)
[TensorRT] VERBOSE: PointWiseV2 has no valid tactics for this config, skipping
[TensorRT] VERBOSE: >>>>>>>>>>>>>>> Chose Runner Type: PointWise Tactic: 128
[TensorRT] VERBOSE: 
[TensorRT] VERBOSE: *************** Autotuning format combination: Float(1,320,102400:32,102400) -> Float(1,320,102400:32,102400) ***************
[TensorRT] VERBOSE: --------------- Timing Runner: PWN((Unnamed Layer* 7) [Activation], (Unnamed Layer* 8) [ElementWise]) (PointWise)
[TensorRT] VERBOSE: Tactic: 128 time 0.077824
[TensorRT] VERBOSE: Tactic: 256 time 0.079744
[TensorRT] VERBOSE: Tactic: 512 time 0.088544
[TensorRT] VERBOSE: Tactic: -32 time 0.119168
[TensorRT] VERBOSE: Tactic: -64 time 0.080352
[TensorRT] VERBOSE: Tactic: -128 time 0.077824
[TensorRT] VERBOSE: Fastest Tactic: 128 Time: 0.077824
[TensorRT] VERBOSE: --------------- Timing Runner: PWN((Unnamed Layer* 7) [Activation], (Unnamed Layer* 8) [ElementWise]) (PointWiseV2)
[TensorRT] VERBOSE: Tactic: 24 time 0.060224
[TensorRT] VERBOSE: Tactic: 25 time 0.062048
[TensorRT] VERBOSE: Tactic: 26 time 0.061952
[TensorRT] VERBOSE: Tactic: 27 time 0.062944
[TensorRT] VERBOSE: Tactic: 31 time 0.059872
[TensorRT] VERBOSE: Fastest Tactic: 31 Time: 0.059872
[TensorRT] VERBOSE: >>>>>>>>>>>>>>> Chose Runner Type: PointWiseV2 Tactic: 31
[TensorRT] VERBOSE: 
[TensorRT] VERBOSE: *************** Autotuning format combination: Float(1,320,102400,3276800) -> Float(1,160,25600,1638400) ***************
[TensorRT] VERBOSE: (Unnamed Layer* 9) [Convolution] (scudnn) Set Tactic Name: volta_scudnn_128x128_relu_medium_nn_v1
[TensorRT] VERBOSE: (Unnamed Layer* 9) [Convolution] (scudnn) Set Tactic Name: volta_scudnn_128x64_relu_xregs_large_nn_v1
[TensorRT] VERBOSE: (Unnamed Layer* 9) [Convolution] (scudnn) Set Tactic Name: volta_scudnn_128x128_relu_small_nn_v1
[TensorRT] VERBOSE: (Unnamed Layer* 9) [Convolution] (scudnn) Set Tactic Name: volta_scudnn_128x128_relu_xregs_large_nn_v1
[TensorRT] VERBOSE: (Unnamed Layer* 9) [Convolution] (scudnn) Set Tactic Name: volta_scudnn_128x64_relu_small_nn_v1
[TensorRT] VERBOSE: (Unnamed Layer* 9) [Convolution] (scudnn) Set Tactic Name: volta_scudnn_128x64_relu_medium_nn_v1
[TensorRT] VERBOSE: (Unnamed Layer* 9) [Convolution] (scudnn) Set Tactic Name: volta_scudnn_128x32_relu_medium_nn_v1
[TensorRT] VERBOSE: (Unnamed Layer* 9) [Convolution] (scudnn) Set Tactic Name: volta_scudnn_128x32_relu_small_nn_v1
[TensorRT] VERBOSE: --------------- Timing Runner: (Unnamed Layer* 9) [Convolution] (FusedConvActConvolution)
[TensorRT] VERBOSE: Tactic: 458751 time 0.195232
[TensorRT] VERBOSE: Fastest Tactic: 458751 Time: 0.195232
[TensorRT] VERBOSE: --------------- Timing Runner: (Unnamed Layer* 9) [Convolution] (CaskConvolution)
[TensorRT] VERBOSE: (Unnamed Layer* 9) [Convolution] (scudnn) Set Tactic Name: volta_scudnn_128x128_relu_medium_nn_v1
[TensorRT] VERBOSE: Tactic: 1825138533642645384 time 0.1848
[TensorRT] VERBOSE: (Unnamed Layer* 9) [Convolution] (scudnn) Set Tactic Name: volta_scudnn_128x64_relu_xregs_large_nn_v1
[TensorRT] VERBOSE: Tactic: 2842488832350522458 time 0.104928
[TensorRT] VERBOSE: (Unnamed Layer* 9) [Convolution] (scudnn) Set Tactic Name: volta_scudnn_128x128_relu_small_nn_v1
[TensorRT] VERBOSE: Tactic: 3915320020053085238 time 0.18432
[TensorRT] VERBOSE: (Unnamed Layer* 9) [Convolution] (scudnn) Set Tactic Name: volta_scudnn_128x128_relu_xregs_large_nn_v1
[TensorRT] VERBOSE: Tactic: 6448355332020552203 time 0.197056
[TensorRT] VERBOSE: (Unnamed Layer* 9) [Convolution] (scudnn) Set Tactic Name: volta_scudnn_128x64_relu_small_nn_v1
[TensorRT] VERBOSE: Tactic: 6808617066150061604 time 0.109056
[TensorRT] VERBOSE: (Unnamed Layer* 9) [Convolution] (scudnn) Set Tactic Name: volta_scudnn_128x64_relu_medium_nn_v1
[TensorRT] VERBOSE: Tactic: -8060443123034038864 time 0.111072
[TensorRT] VERBOSE: (Unnamed Layer* 9) [Convolution] (scudnn) Set Tactic Name: volta_scudnn_128x32_relu_medium_nn_v1
[TensorRT] VERBOSE: Tactic: -4420849921117327522 time 0.14384
[TensorRT] VERBOSE: (Unnamed Layer* 9) [Convolution] (scudnn) Set Tactic Name: volta_scudnn_128x32_relu_small_nn_v1
[TensorRT] VERBOSE: Tactic: -3946921629105938337 time 0.149824
[TensorRT] VERBOSE: Fastest Tactic: 2842488832350522458 Time: 0.104928
[TensorRT] VERBOSE: --------------- Timing Runner: (Unnamed Layer* 9) [Convolution] (CudaConvolution)
[TensorRT] VERBOSE: Tactic: 0 time 0.307232
[TensorRT] VERBOSE: Tactic: 1 time 0.1296
[TensorRT] VERBOSE: Tactic: 2 skipped. Scratch requested: 29491200, available: 20971520
[TensorRT] VERBOSE: Tactic: 5 time 3.8897
[TensorRT] VERBOSE: Tactic: 56 time 0.3072
[TensorRT] VERBOSE: Tactic: 57 time 0.130752
[TensorRT] VERBOSE: Tactic: 58 skipped. Scratch requested: 29491200, available: 20971520
[TensorRT] VERBOSE: Tactic: 61 time 3.90566
[TensorRT] VERBOSE: Fastest Tactic: 1 Time: 0.1296
[TensorRT] VERBOSE: --------------- Timing Runner: (Unnamed Layer* 9) [Convolution] (CudaDepthwiseConvolution)
[TensorRT] VERBOSE: CudaDepthwiseConvolution has no valid tactics for this config, skipping
[TensorRT] VERBOSE: --------------- Timing Runner: (Unnamed Layer* 9) [Convolution] (CublasConvolution)
[TensorRT] VERBOSE: CublasConvolution has no valid tactics for this config, skipping
[TensorRT] VERBOSE: >>>>>>>>>>>>>>> Chose Runner Type: CaskConvolution Tactic: 2842488832350522458
[TensorRT] VERBOSE: (Unnamed Layer* 9) [Convolution] (scudnn) Set Tactic Name: volta_scudnn_128x64_relu_xregs_large_nn_v1
[TensorRT] VERBOSE: 
[TensorRT] VERBOSE: (Unnamed Layer* 9) [Convolution] (scudnn) Set Tactic Name: volta_scudnn_128x128_relu_medium_nn_v1
[TensorRT] VERBOSE: (Unnamed Layer* 9) [Convolution] (scudnn) Set Tactic Name: volta_scudnn_128x64_relu_xregs_large_nn_v1
[TensorRT] VERBOSE: (Unnamed Layer* 9) [Convolution] (scudnn) Set Tactic Name: volta_scudnn_128x128_relu_small_nn_v1
[TensorRT] VERBOSE: (Unnamed Layer* 9) [Convolution] (scudnn) Set Tactic Name: volta_scudnn_128x128_relu_xregs_large_nn_v1
[TensorRT] VERBOSE: (Unnamed Layer* 9) [Convolution] (scudnn) Set Tactic Name: volta_scudnn_128x64_relu_small_nn_v1
[TensorRT] VERBOSE: (Unnamed Layer* 9) [Convolution] (scudnn) Set Tactic Name: volta_scudnn_128x64_relu_medium_nn_v1
[TensorRT] VERBOSE: (Unnamed Layer* 9) [Convolution] (scudnn) Set Tactic Name: volta_scudnn_128x32_relu_medium_nn_v1
[TensorRT] VERBOSE: (Unnamed Layer* 9) [Convolution] (scudnn) Set Tactic Name: volta_scudnn_128x32_relu_small_nn_v1
[TensorRT] VERBOSE: (Unnamed Layer* 9) [Convolution] (scudnn) Set Tactic Name: volta_scudnn_128x64_relu_xregs_large_nn_v1
[TensorRT] VERBOSE: *************** Autotuning format combination: Float(32,10240,1,3276800) -> Float(64,10240,1,1638400) ***************
[TensorRT] VERBOSE: (Unnamed Layer* 9) [Convolution] (scudnn) Set Tactic Name: volta_scudnn_128x128_relu_exp_medium_nhwc_tn_v1
[TensorRT] VERBOSE: (Unnamed Layer* 9) [Convolution] (scudnn) Set Tactic Name: volta_scudnn_128x128_ldg4_relu_exp_large_nhwc_tn_v1
[TensorRT] VERBOSE: (Unnamed Layer* 9) [Convolution] (scudnn) Set Tactic Name: volta_scudnn_128x64_sliced1x2_ldg4_relu_exp_small_nhwc_tn_v1
[TensorRT] VERBOSE: (Unnamed Layer* 9) [Convolution] (scudnn) Set Tactic Name: volta_scudnn_128x128_relu_exp_small_nhwc_tn_v1
[TensorRT] VERBOSE: (Unnamed Layer* 9) [Convolution] (scudnn) Set Tactic Name: volta_scudnn_128x32_sliced1x4_ldg4_relu_exp_small_nhwc_tn_v1
[TensorRT] VERBOSE: (Unnamed Layer* 9) [Convolution] (scudnn) Set Tactic Name: volta_scudnn_128x128_ldg4_relu_exp_medium_nhwc_tn_v1
[TensorRT] VERBOSE: (Unnamed Layer* 9) [Convolution] (scudnn) Set Tactic Name: volta_scudnn_128x64_sliced1x2_ldg4_relu_exp_medium_nhwc_tn_v1
[TensorRT] VERBOSE: (Unnamed Layer* 9) [Convolution] (scudnn) Set Tactic Name: volta_scudnn_128x128_ldg4_relu_exp_small_nhwc_tn_v1
[TensorRT] VERBOSE: (Unnamed Layer* 9) [Convolution] (scudnn) Set Tactic Name: volta_scudnn_128x128_relu_exp_large_nhwc_tn_v1
[TensorRT] VERBOSE: (Unnamed Layer* 9) [Convolution] (scudnn) Set Tactic Name: volta_scudnn_128x64_sliced1x2_ldg4_relu_exp_large_nhwc_tn_v1
[TensorRT] VERBOSE: (Unnamed Layer* 9) [Convolution] (scudnn) Set Tactic Name: volta_scudnn_128x32_sliced1x4_ldg4_relu_exp_medium_nhwc_tn_v1
[TensorRT] VERBOSE: --------------- Timing Runner: (Unnamed Layer* 9) [Convolution] (FusedConvActConvolution)
[TensorRT] VERBOSE: FusedConvActConvolution has no valid tactics for this config, skipping
[TensorRT] VERBOSE: --------------- Timing Runner: (Unnamed Layer* 9) [Convolution] (CaskConvolution)
[TensorRT] VERBOSE: (Unnamed Layer* 9) [Convolution] (scudnn) Set Tactic Name: volta_scudnn_128x128_relu_exp_medium_nhwc_tn_v1
[TensorRT] VERBOSE: Tactic: 861694390046228376 time 0.186848
[TensorRT] VERBOSE: (Unnamed Layer* 9) [Convolution] (scudnn) Set Tactic Name: volta_scudnn_128x128_ldg4_relu_exp_large_nhwc_tn_v1
[TensorRT] VERBOSE: Tactic: 1017870653102653567 time 0.185856
[TensorRT] VERBOSE: (Unnamed Layer* 9) [Convolution] (scudnn) Set Tactic Name: volta_scudnn_128x64_sliced1x2_ldg4_relu_exp_small_nhwc_tn_v1
[TensorRT] VERBOSE: Tactic: 5258189349241541167 time 0.106688
[TensorRT] VERBOSE: (Unnamed Layer* 9) [Convolution] (scudnn) Set Tactic Name: volta_scudnn_128x128_relu_exp_small_nhwc_tn_v1
[TensorRT] VERBOSE: Tactic: 5821621277990374316 time 0.186912
[TensorRT] VERBOSE: (Unnamed Layer* 9) [Convolution] (scudnn) Set Tactic Name: volta_scudnn_128x32_sliced1x4_ldg4_relu_exp_small_nhwc_tn_v1
[TensorRT] VERBOSE: Tactic: 5863767799113001648 time 0.136736
[TensorRT] VERBOSE: (Unnamed Layer* 9) [Convolution] (scudnn) Set Tactic Name: volta_scudnn_128x128_ldg4_relu_exp_medium_nhwc_tn_v1
[TensorRT] VERBOSE: Tactic: -9147980667639709536 time 0.185792
[TensorRT] VERBOSE: (Unnamed Layer* 9) [Convolution] (scudnn) Set Tactic Name: volta_scudnn_128x64_sliced1x2_ldg4_relu_exp_medium_nhwc_tn_v1
[TensorRT] VERBOSE: Tactic: -8850904373104590857 time 0.106496
[TensorRT] VERBOSE: (Unnamed Layer* 9) [Convolution] (scudnn) Set Tactic Name: volta_scudnn_128x128_ldg4_relu_exp_small_nhwc_tn_v1
[TensorRT] VERBOSE: Tactic: -7751035352149795660 time 0.185024
[TensorRT] VERBOSE: (Unnamed Layer* 9) [Convolution] (scudnn) Set Tactic Name: volta_scudnn_128x128_relu_exp_large_nhwc_tn_v1
[TensorRT] VERBOSE: Tactic: -3853827649136781465 time 0.188416
[TensorRT] VERBOSE: (Unnamed Layer* 9) [Convolution] (scudnn) Set Tactic Name: volta_scudnn_128x64_sliced1x2_ldg4_relu_exp_large_nhwc_tn_v1
[TensorRT] VERBOSE: Tactic: -3263369460438823196 time 0.106496
[TensorRT] VERBOSE: (Unnamed Layer* 9) [Convolution] (scudnn) Set Tactic Name: volta_scudnn_128x32_sliced1x4_ldg4_relu_exp_medium_nhwc_tn_v1
[TensorRT] VERBOSE: Tactic: -423878181466897819 time 0.135936
[TensorRT] VERBOSE: Fastest Tactic: -8850904373104590857 Time: 0.106496
[TensorRT] VERBOSE: --------------- Timing Runner: (Unnamed Layer* 9) [Convolution] (CudaConvolution)
[TensorRT] VERBOSE: CudaConvolution has no valid tactics for this config, skipping
[TensorRT] VERBOSE: --------------- Timing Runner: (Unnamed Layer* 9) [Convolution] (CudaDepthwiseConvolution)
[TensorRT] VERBOSE: CudaDepthwiseConvolution has no valid tactics for this config, skipping
[TensorRT] VERBOSE: --------------- Timing Runner: (Unnamed Layer* 9) [Convolution] (CublasConvolution)
[TensorRT] VERBOSE: CublasConvolution has no valid tactics for this config, skipping
[TensorRT] VERBOSE: >>>>>>>>>>>>>>> Chose Runner Type: CaskConvolution Tactic: -8850904373104590857
[TensorRT] VERBOSE: (Unnamed Layer* 9) [Convolution] (scudnn) Set Tactic Name: volta_scudnn_128x64_sliced1x2_ldg4_relu_exp_medium_nhwc_tn_v1
[TensorRT] VERBOSE: 
[TensorRT] VERBOSE: (Unnamed Layer* 9) [Convolution] (scudnn) Set Tactic Name: volta_scudnn_128x128_relu_exp_medium_nhwc_tn_v1
[TensorRT] VERBOSE: (Unnamed Layer* 9) [Convolution] (scudnn) Set Tactic Name: volta_scudnn_128x128_ldg4_relu_exp_large_nhwc_tn_v1
[TensorRT] VERBOSE: (Unnamed Layer* 9) [Convolution] (scudnn) Set Tactic Name: volta_scudnn_128x64_sliced1x2_ldg4_relu_exp_small_nhwc_tn_v1
[TensorRT] VERBOSE: (Unnamed Layer* 9) [Convolution] (scudnn) Set Tactic Name: volta_scudnn_128x128_relu_exp_small_nhwc_tn_v1
[TensorRT] VERBOSE: (Unnamed Layer* 9) [Convolution] (scudnn) Set Tactic Name: volta_scudnn_128x32_sliced1x4_ldg4_relu_exp_small_nhwc_tn_v1
[TensorRT] VERBOSE: (Unnamed Layer* 9) [Convolution] (scudnn) Set Tactic Name: volta_scudnn_128x128_ldg4_relu_exp_medium_nhwc_tn_v1
[TensorRT] VERBOSE: (Unnamed Layer* 9) [Convolution] (scudnn) Set Tactic Name: volta_scudnn_128x64_sliced1x2_ldg4_relu_exp_medium_nhwc_tn_v1
[TensorRT] VERBOSE: (Unnamed Layer* 9) [Convolution] (scudnn) Set Tactic Name: volta_scudnn_128x128_ldg4_relu_exp_small_nhwc_tn_v1
[TensorRT] VERBOSE: (Unnamed Layer* 9) [Convolution] (scudnn) Set Tactic Name: volta_scudnn_128x128_relu_exp_large_nhwc_tn_v1
[TensorRT] VERBOSE: (Unnamed Layer* 9) [Convolution] (scudnn) Set Tactic Name: volta_scudnn_128x64_sliced1x2_ldg4_relu_exp_large_nhwc_tn_v1
[TensorRT] VERBOSE: (Unnamed Layer* 9) [Convolution] (scudnn) Set Tactic Name: volta_scudnn_128x32_sliced1x4_ldg4_relu_exp_medium_nhwc_tn_v1
[TensorRT] VERBOSE: (Unnamed Layer* 9) [Convolution] (scudnn) Set Tactic Name: volta_scudnn_128x64_sliced1x2_ldg4_relu_exp_medium_nhwc_tn_v1
[TensorRT] VERBOSE: --------------- Timing Runner: <reformat> (Reformat)
[TensorRT] VERBOSE: Tactic: 1002 time 0.030272
[TensorRT] VERBOSE: Tactic: 0 time 0.045536
[TensorRT] VERBOSE: Fastest Tactic: 1002 Time: 0.030272
[TensorRT] VERBOSE: --------------- Timing Runner: <reformat> (Reformat)
[TensorRT] VERBOSE: Tactic: 1002 time 0.04288
[TensorRT] VERBOSE: Tactic: 0 time 0.090112
[TensorRT] VERBOSE: Fastest Tactic: 1002 Time: 0.04288
[TensorRT] VERBOSE: --------------- Timing Runner: <reformat> (Reformat)
[TensorRT] VERBOSE: Tactic: 1002 time 0.03136
[TensorRT] VERBOSE: Tactic: 0 time 0.057216
[TensorRT] VERBOSE: Fastest Tactic: 1002 Time: 0.03136
[TensorRT] VERBOSE: --------------- Timing Runner: <reformat> (Reformat)
[TensorRT] VERBOSE: Tactic: 1002 time 0.053696
[TensorRT] VERBOSE: Tactic: 0 time 0.179744
[TensorRT] VERBOSE: Fastest Tactic: 1002 Time: 0.053696
[TensorRT] VERBOSE: --------------- Timing Runner: <reformat> (Reformat)
[TensorRT] VERBOSE: Tactic: 1002 time 0.06304
[TensorRT] VERBOSE: Tactic: 0 time 0.057248
[TensorRT] VERBOSE: Fastest Tactic: 0 Time: 0.057248
[TensorRT] VERBOSE: --------------- Timing Runner: <reformat> (Reformat)
[TensorRT] VERBOSE: Tactic: 1002 time 0.053632
[TensorRT] VERBOSE: Tactic: 0 time 0.033216
[TensorRT] VERBOSE: Fastest Tactic: 0 Time: 0.033216
[TensorRT] VERBOSE: *************** Autotuning format combination: Float(1,160,25600,1638400) -> Float(1,160,25600,1638400) ***************
[TensorRT] VERBOSE: --------------- Timing Runner: PWN((Unnamed Layer* 11) [Activation], (Unnamed Layer* 12) [ElementWise]) (PointWise)
[TensorRT] VERBOSE: Tactic: 128 time 0.04144
[TensorRT] VERBOSE: Tactic: 256 time 0.043008
[TensorRT] VERBOSE: Tactic: 512 time 0.047104
[TensorRT] VERBOSE: Tactic: -32 time 0.075968
[TensorRT] VERBOSE: Tactic: -64 time 0.048512
[TensorRT] VERBOSE: Tactic: -128 time 0.043264
[TensorRT] VERBOSE: Fastest Tactic: 128 Time: 0.04144
[TensorRT] VERBOSE: --------------- Timing Runner: PWN((Unnamed Layer* 11) [Activation], (Unnamed Layer* 12) [ElementWise]) (PointWiseV2)
[TensorRT] VERBOSE: Tactic: 0 time 0.028864
[TensorRT] VERBOSE: Tactic: 1 time 0.028384
[TensorRT] VERBOSE: Tactic: 2 time 0.027104
[TensorRT] VERBOSE: Tactic: 3 time 0.028352
[TensorRT] VERBOSE: Tactic: 4 time 0.027136
[TensorRT] VERBOSE: Tactic: 5 time 0.027104
[TensorRT] VERBOSE: Tactic: 6 time 0.028672
[TensorRT] VERBOSE: Tactic: 7 time 0.027072
[TensorRT] VERBOSE: Tactic: 8 time 0.028672
[TensorRT] VERBOSE: Tactic: 9 time 0.028544
[TensorRT] VERBOSE: Tactic: 28 time 0.028672
[TensorRT] VERBOSE: Fastest Tactic: 7 Time: 0.027072
[TensorRT] VERBOSE: >>>>>>>>>>>>>>> Chose Runner Type: PointWiseV2 Tactic: 7
[TensorRT] VERBOSE: 
[TensorRT] VERBOSE: *************** Autotuning format combination: Float(64,10240,1,1638400) -> Float(64,10240,1,1638400) ***************
[TensorRT] VERBOSE: --------------- Timing Runner: PWN((Unnamed Layer* 11) [Activation], (Unnamed Layer* 12) [ElementWise]) (PointWise)
[TensorRT] VERBOSE: Tactic: 128 time 0.041408
[TensorRT] VERBOSE: Tactic: 256 time 0.042784
[TensorRT] VERBOSE: Tactic: 512 time 0.047424
[TensorRT] VERBOSE: Tactic: -32 time 0.075776
[TensorRT] VERBOSE: Tactic: -64 time 0.047456
[TensorRT] VERBOSE: Tactic: -128 time 0.043296
[TensorRT] VERBOSE: Fastest Tactic: 128 Time: 0.041408
[TensorRT] VERBOSE: --------------- Timing Runner: PWN((Unnamed Layer* 11) [Activation], (Unnamed Layer* 12) [ElementWise]) (PointWiseV2)
[TensorRT] VERBOSE: PointWiseV2 has no valid tactics for this config, skipping
[TensorRT] VERBOSE: >>>>>>>>>>>>>>> Chose Runner Type: PointWise Tactic: 128
[TensorRT] VERBOSE: 
[TensorRT] VERBOSE: *************** Autotuning format combination: Float(1,160,25600:32,51200) -> Float(1,160,25600:32,51200) ***************
[TensorRT] VERBOSE: --------------- Timing Runner: PWN((Unnamed Layer* 11) [Activation], (Unnamed Layer* 12) [ElementWise]) (PointWise)
[TensorRT] VERBOSE: Tactic: 128 time 0.041856
[TensorRT] VERBOSE: Tactic: 256 time 0.042752
[TensorRT] VERBOSE: Tactic: 512 time 0.047552
[TensorRT] VERBOSE: Tactic: -32 time 0.076256
[TensorRT] VERBOSE: Tactic: -64 time 0.04832
[TensorRT] VERBOSE: Tactic: -128 time 0.043456
[TensorRT] VERBOSE: Fastest Tactic: 128 Time: 0.041856
[TensorRT] VERBOSE: --------------- Timing Runner: PWN((Unnamed Layer* 11) [Activation], (Unnamed Layer* 12) [ElementWise]) (PointWiseV2)
[TensorRT] VERBOSE: Tactic: 24 time 0.03072
[TensorRT] VERBOSE: Tactic: 25 time 0.031168
[TensorRT] VERBOSE: Tactic: 26 time 0.033184
[TensorRT] VERBOSE: Tactic: 27 time 0.029504
[TensorRT] VERBOSE: Tactic: 31 time 0.030368
[TensorRT] VERBOSE: Fastest Tactic: 27 Time: 0.029504
[TensorRT] VERBOSE: >>>>>>>>>>>>>>> Chose Runner Type: PointWiseV2 Tactic: 27
[TensorRT] VERBOSE: 
[TensorRT] VERBOSE: *************** Autotuning format combination: Float(1,160,25600,1638400) -> Float(1,160,25600,1638400) ***************
[TensorRT] VERBOSE: (Unnamed Layer* 13) [Convolution] || (Unnamed Layer* 17) [Convolution] (scudnn) Set Tactic Name: volta_scudnn_128x128_relu_interior_nn_v1
[TensorRT] VERBOSE: (Unnamed Layer* 13) [Convolution] || (Unnamed Layer* 17) [Convolution] (scudnn) Set Tactic Name: volta_scudnn_128x128_relu_medium_nn_v1
[TensorRT] VERBOSE: (Unnamed Layer* 13) [Convolution] || (Unnamed Layer* 17) [Convolution] (scudnn) Set Tactic Name: volta_scudnn_128x32_relu_interior_nn_v1
[TensorRT] VERBOSE: (Unnamed Layer* 13) [Convolution] || (Unnamed Layer* 17) [Convolution] (scudnn) Set Tactic Name: volta_scudnn_128x128_relu_small_nn_v1
[TensorRT] VERBOSE: (Unnamed Layer* 13) [Convolution] || (Unnamed Layer* 17) [Convolution] (scudnn) Set Tactic Name: volta_scudnn_128x64_relu_small_nn_v1
[TensorRT] VERBOSE: (Unnamed Layer* 13) [Convolution] || (Unnamed Layer* 17) [Convolution] (scudnn) Set Tactic Name: volta_scudnn_128x64_relu_interior_nn_v1
[TensorRT] VERBOSE: (Unnamed Layer* 13) [Convolution] || (Unnamed Layer* 17) [Convolution] (scudnn) Set Tactic Name: volta_scudnn_128x64_relu_medium_nn_v1
[TensorRT] VERBOSE: (Unnamed Layer* 13) [Convolution] || (Unnamed Layer* 17) [Convolution] (scudnn) Set Tactic Name: volta_scudnn_128x32_relu_medium_nn_v1
[TensorRT] VERBOSE: (Unnamed Layer* 13) [Convolution] || (Unnamed Layer* 17) [Convolution] (scudnn) Set Tactic Name: volta_scudnn_128x32_relu_small_nn_v1
[TensorRT] VERBOSE: --------------- Timing Runner: (Unnamed Layer* 13) [Convolution] || (Unnamed Layer* 17) [Convolution] (FusedConvActConvolution)
[TensorRT] VERBOSE: Tactic: 589823 time 0.150592
[TensorRT] VERBOSE: Tactic: 655359 time 0.116736
[TensorRT] VERBOSE: Tactic: 786431 time 0.13248
[TensorRT] VERBOSE: Tactic: 851967 time 0.137216
[TensorRT] VERBOSE: Tactic: 1179647 time 0.117184
[TensorRT] VERBOSE: Tactic: 1310719 time 0.119584
[TensorRT] VERBOSE: Tactic: 1376255 time 0.110784
[TensorRT] VERBOSE: Tactic: 1441791 time 0.137216
[TensorRT] VERBOSE: Tactic: 1507327 time 0.115168
[TensorRT] VERBOSE: Tactic: 1638399 time 0.124448
[TensorRT] VERBOSE: Tactic: 1835007 time 0.139744
[TensorRT] VERBOSE: Tactic: 1900543 time 0.127168
[TensorRT] VERBOSE: Tactic: 2097151 time 0.131488
[TensorRT] VERBOSE: Tactic: 2162687 time 0.114944
[TensorRT] VERBOSE: Tactic: 2293759 time 0.12288
[TensorRT] VERBOSE: Tactic: 2359295 time 0.108992
[TensorRT] VERBOSE: Tactic: 2686975 time 0.125152
[TensorRT] VERBOSE: Tactic: 3080191 time 0.114688
[TensorRT] VERBOSE: Tactic: 3342335 time 0.11856
[TensorRT] VERBOSE: Tactic: 3407871 time 0.109184
[TensorRT] VERBOSE: Tactic: 3538943 time 0.106496
[TensorRT] VERBOSE: Tactic: 3670015 time 0.129024
[TensorRT] VERBOSE: Tactic: 3932159 time 0.118784
[TensorRT] VERBOSE: Tactic: 3997695 time 0.12944
[TensorRT] VERBOSE: Tactic: 4063231 time 0.132608
[TensorRT] VERBOSE: Tactic: 4194303 time 0.115104
[TensorRT] VERBOSE: Tactic: 4259839 time 0.125408
[TensorRT] VERBOSE: Tactic: 4325375 time 0.113088
[TensorRT] VERBOSE: Tactic: 4521983 time 0.128928
[TensorRT] VERBOSE: Tactic: 4587519 time 0.114688
[TensorRT] VERBOSE: Tactic: 4653055 time 0.106976
[TensorRT] VERBOSE: Tactic: 4915199 time 0.115744
[TensorRT] VERBOSE: Tactic: 4980735 time 0.11312
[TensorRT] VERBOSE: Tactic: 5177343 time 0.127328
[TensorRT] VERBOSE: Tactic: 5242879 time 0.115072
[TensorRT] VERBOSE: Tactic: 5373951 time 0.146208
[TensorRT] VERBOSE: Tactic: 5439487 time 0.184512
[TensorRT] VERBOSE: Tactic: 5570559 time 0.117216
[TensorRT] VERBOSE: Tactic: 5636095 time 0.131776
[TensorRT] VERBOSE: Tactic: 5701631 time 0.125376
[TensorRT] VERBOSE: Tactic: 5767167 time 0.416224
[TensorRT] VERBOSE: Tactic: 5832703 time 0.108544
[TensorRT] VERBOSE: Tactic: 5898239 time 0.111264
[TensorRT] VERBOSE: Tactic: 6029311 time 0.122688
[TensorRT] VERBOSE: Tactic: 6225919 time 0.11056
[TensorRT] VERBOSE: Tactic: 6291455 time 0.117216
[TensorRT] VERBOSE: Tactic: 6422527 time 0.120832
[TensorRT] VERBOSE: Tactic: 6750207 time 0.135648
[TensorRT] VERBOSE: Tactic: 6815743 time 0.137216
[TensorRT] VERBOSE: Tactic: 6946815 time 0.176096
[TensorRT] VERBOSE: Tactic: 7012351 time 0.13152
[TensorRT] VERBOSE: Tactic: 7077887 time 0.106496
[TensorRT] VERBOSE: Tactic: 7143423 time 0.180192
[TensorRT] VERBOSE: Tactic: 7208959 time 0.119232
[TensorRT] VERBOSE: Tactic: 7340031 time 0.11616
[TensorRT] VERBOSE: Tactic: 7405567 time 0.114688
[TensorRT] VERBOSE: Tactic: 7536639 time 0.146528
[TensorRT] VERBOSE: Tactic: 7602175 time 0.123328
[TensorRT] VERBOSE: Tactic: 7733247 time 0.108544
[TensorRT] VERBOSE: Tactic: 7798783 time 0.131552
[TensorRT] VERBOSE: Tactic: 8191999 time 0.141792
[TensorRT] VERBOSE: Tactic: 8257535 time 0.12288
[TensorRT] VERBOSE: Tactic: 8323071 time 0.1312
[TensorRT] VERBOSE: Tactic: 8650751 time 0.143072
[TensorRT] VERBOSE: Tactic: 8716287 time 0.134752
[TensorRT] VERBOSE: Tactic: 9109503 time 0.135392
[TensorRT] VERBOSE: Tactic: 9568255 time 0.116352
[TensorRT] VERBOSE: Tactic: 9895935 time 0.115744
[TensorRT] VERBOSE: Tactic: 10223615 time 0.12512
[TensorRT] VERBOSE: Tactic: 10354687 time 0.121312
[TensorRT] VERBOSE: Tactic: 10551295 time 0.14336
[TensorRT] VERBOSE: Tactic: 10747903 time 0.104448
[TensorRT] VERBOSE: Tactic: 10944511 time 0.11264
[TensorRT] VERBOSE: Fastest Tactic: 10747903 Time: 0.104448
[TensorRT] VERBOSE: --------------- Timing Runner: (Unnamed Layer* 13) [Convolution] || (Unnamed Layer* 17) [Convolution] (CaskConvolution)
[TensorRT] VERBOSE: (Unnamed Layer* 13) [Convolution] || (Unnamed Layer* 17) [Convolution] (scudnn) Set Tactic Name: volta_scudnn_128x128_relu_interior_nn_v1
[TensorRT] VERBOSE: Tactic: 1754569683116234317 time 0.055008
[TensorRT] VERBOSE: (Unnamed Layer* 13) [Convolution] || (Unnamed Layer* 17) [Convolution] (scudnn) Set Tactic Name: volta_scudnn_128x128_relu_medium_nn_v1
[TensorRT] VERBOSE: Tactic: 1825138533642645384 time 0.05504
[TensorRT] VERBOSE: (Unnamed Layer* 13) [Convolution] || (Unnamed Layer* 17) [Convolution] (scudnn) Set Tactic Name: volta_scudnn_128x32_relu_interior_nn_v1
[TensorRT] VERBOSE: Tactic: 2733356012094739613 time 0.04288
[TensorRT] VERBOSE: (Unnamed Layer* 13) [Convolution] || (Unnamed Layer* 17) [Convolution] (scudnn) Set Tactic Name: volta_scudnn_128x128_relu_small_nn_v1
[TensorRT] VERBOSE: Tactic: 3915320020053085238 time 0.055264
[TensorRT] VERBOSE: (Unnamed Layer* 13) [Convolution] || (Unnamed Layer* 17) [Convolution] (scudnn) Set Tactic Name: volta_scudnn_128x64_relu_small_nn_v1
[TensorRT] VERBOSE: Tactic: 6808617066150061604 time 0.03664
[TensorRT] VERBOSE: (Unnamed Layer* 13) [Convolution] || (Unnamed Layer* 17) [Convolution] (scudnn) Set Tactic Name: volta_scudnn_128x64_relu_interior_nn_v1
[TensorRT] VERBOSE: Tactic: 9091006216302412844 time 0.034816
[TensorRT] VERBOSE: (Unnamed Layer* 13) [Convolution] || (Unnamed Layer* 17) [Convolution] (scudnn) Set Tactic Name: volta_scudnn_128x64_relu_medium_nn_v1
[TensorRT] VERBOSE: Tactic: -8060443123034038864 time 0.036832
[TensorRT] VERBOSE: (Unnamed Layer* 13) [Convolution] || (Unnamed Layer* 17) [Convolution] (scudnn) Set Tactic Name: volta_scudnn_128x32_relu_medium_nn_v1
[TensorRT] VERBOSE: Tactic: -4420849921117327522 time 0.048864
[TensorRT] VERBOSE: (Unnamed Layer* 13) [Convolution] || (Unnamed Layer* 17) [Convolution] (scudnn) Set Tactic Name: volta_scudnn_128x32_relu_small_nn_v1
[TensorRT] VERBOSE: Tactic: -3946921629105938337 time 0.045056
[TensorRT] VERBOSE: Fastest Tactic: 9091006216302412844 Time: 0.034816
[TensorRT] VERBOSE: --------------- Timing Runner: (Unnamed Layer* 13) [Convolution] || (Unnamed Layer* 17) [Convolution] (CudaConvolution)
[TensorRT] VERBOSE: Tactic: 0 time 0.083456
[TensorRT] VERBOSE: Tactic: 1 time 0.057984
[TensorRT] VERBOSE: Tactic: 2 time 0.141632
[TensorRT] VERBOSE: Tactic: 4 skipped. Scratch requested: 2198093824, available: 20971520
[TensorRT] VERBOSE: Tactic: 5 time 0.189408
[TensorRT] VERBOSE: Tactic: 56 time 0.083968
[TensorRT] VERBOSE: Tactic: 57 time 0.057824
[TensorRT] VERBOSE: Tactic: 58 time 0.14176
[TensorRT] VERBOSE: Tactic: 60 skipped. Scratch requested: 2198093824, available: 20971520
[TensorRT] VERBOSE: Tactic: 61 time 0.187776
[TensorRT] VERBOSE: Fastest Tactic: 57 Time: 0.057824
[TensorRT] VERBOSE: --------------- Timing Runner: (Unnamed Layer* 13) [Convolution] || (Unnamed Layer* 17) [Convolution] (CudaDepthwiseConvolution)
[TensorRT] VERBOSE: CudaDepthwiseConvolution has no valid tactics for this config, skipping
[TensorRT] VERBOSE: --------------- Timing Runner: (Unnamed Layer* 13) [Convolution] || (Unnamed Layer* 17) [Convolution] (CublasConvolution)
[TensorRT] VERBOSE: CublasConvolution has no valid tactics for this config, skipping
[TensorRT] VERBOSE: >>>>>>>>>>>>>>> Chose Runner Type: CaskConvolution Tactic: 9091006216302412844
[TensorRT] VERBOSE: (Unnamed Layer* 13) [Convolution] || (Unnamed Layer* 17) [Convolution] (scudnn) Set Tactic Name: volta_scudnn_128x64_relu_interior_nn_v1
[TensorRT] VERBOSE: 
[TensorRT] VERBOSE: (Unnamed Layer* 13) [Convolution] || (Unnamed Layer* 17) [Convolution] (scudnn) Set Tactic Name: volta_scudnn_128x128_relu_interior_nn_v1
[TensorRT] VERBOSE: (Unnamed Layer* 13) [Convolution] || (Unnamed Layer* 17) [Convolution] (scudnn) Set Tactic Name: volta_scudnn_128x128_relu_medium_nn_v1
[TensorRT] VERBOSE: (Unnamed Layer* 13) [Convolution] || (Unnamed Layer* 17) [Convolution] (scudnn) Set Tactic Name: volta_scudnn_128x32_relu_interior_nn_v1
[TensorRT] VERBOSE: (Unnamed Layer* 13) [Convolution] || (Unnamed Layer* 17) [Convolution] (scudnn) Set Tactic Name: volta_scudnn_128x128_relu_small_nn_v1
[TensorRT] VERBOSE: (Unnamed Layer* 13) [Convolution] || (Unnamed Layer* 17) [Convolution] (scudnn) Set Tactic Name: volta_scudnn_128x64_relu_small_nn_v1
[TensorRT] VERBOSE: (Unnamed Layer* 13) [Convolution] || (Unnamed Layer* 17) [Convolution] (scudnn) Set Tactic Name: volta_scudnn_128x64_relu_interior_nn_v1
[TensorRT] VERBOSE: (Unnamed Layer* 13) [Convolution] || (Unnamed Layer* 17) [Convolution] (scudnn) Set Tactic Name: volta_scudnn_128x64_relu_medium_nn_v1
[TensorRT] VERBOSE: (Unnamed Layer* 13) [Convolution] || (Unnamed Layer* 17) [Convolution] (scudnn) Set Tactic Name: volta_scudnn_128x32_relu_medium_nn_v1
[TensorRT] VERBOSE: (Unnamed Layer* 13) [Convolution] || (Unnamed Layer* 17) [Convolution] (scudnn) Set Tactic Name: volta_scudnn_128x32_relu_small_nn_v1
[TensorRT] VERBOSE: (Unnamed Layer* 13) [Convolution] || (Unnamed Layer* 17) [Convolution] (scudnn) Set Tactic Name: volta_scudnn_128x64_relu_interior_nn_v1
[TensorRT] VERBOSE: *************** Autotuning format combination: Float(64,10240,1,1638400) -> Float(64,10240,1,1638400) ***************
[TensorRT] VERBOSE: (Unnamed Layer* 13) [Convolution] || (Unnamed Layer* 17) [Convolution] (scudnn) Set Tactic Name: volta_scudnn_128x128_relu_exp_medium_nhwc_tn_v1
[TensorRT] VERBOSE: (Unnamed Layer* 13) [Convolution] || (Unnamed Layer* 17) [Convolution] (scudnn) Set Tactic Name: volta_scudnn_128x64_sliced1x2_ldg4_relu_exp_small_nhwc_tn_v1
[TensorRT] VERBOSE: (Unnamed Layer* 13) [Convolution] || (Unnamed Layer* 17) [Convolution] (scudnn) Set Tactic Name: volta_scudnn_128x128_relu_exp_small_nhwc_tn_v1
[TensorRT] VERBOSE: (Unnamed Layer* 13) [Convolution] || (Unnamed Layer* 17) [Convolution] (scudnn) Set Tactic Name: volta_scudnn_128x32_sliced1x4_ldg4_relu_exp_small_nhwc_tn_v1
[TensorRT] VERBOSE: (Unnamed Layer* 13) [Convolution] || (Unnamed Layer* 17) [Convolution] (scudnn) Set Tactic Name: volta_scudnn_128x128_ldg4_relu_exp_medium_nhwc_tn_v1
[TensorRT] VERBOSE: (Unnamed Layer* 13) [Convolution] || (Unnamed Layer* 17) [Convolution] (scudnn) Set Tactic Name: volta_scudnn_128x128_ldg4_relu_exp_interior_nhwc_tn_v1
[TensorRT] VERBOSE: (Unnamed Layer* 13) [Convolution] || (Unnamed Layer* 17) [Convolution] (scudnn) Set Tactic Name: volta_scudnn_128x64_sliced1x2_ldg4_relu_exp_medium_nhwc_tn_v1
[TensorRT] VERBOSE: (Unnamed Layer* 13) [Convolution] || (Unnamed Layer* 17) [Convolution] (scudnn) Set Tactic Name: volta_scudnn_128x32_sliced1x4_ldg4_relu_exp_interior_nhwc_tn_v1
[TensorRT] VERBOSE: (Unnamed Layer* 13) [Convolution] || (Unnamed Layer* 17) [Convolution] (scudnn) Set Tactic Name: volta_scudnn_128x128_ldg4_relu_exp_small_nhwc_tn_v1
[TensorRT] VERBOSE: (Unnamed Layer* 13) [Convolution] || (Unnamed Layer* 17) [Convolution] (scudnn) Set Tactic Name: volta_scudnn_128x128_relu_exp_interior_nhwc_tn_v1
[TensorRT] VERBOSE: (Unnamed Layer* 13) [Convolution] || (Unnamed Layer* 17) [Convolution] (scudnn) Set Tactic Name: volta_scudnn_128x64_sliced1x2_ldg4_relu_exp_interior_nhwc_tn_v1
[TensorRT] VERBOSE: (Unnamed Layer* 13) [Convolution] || (Unnamed Layer* 17) [Convolution] (scudnn) Set Tactic Name: volta_scudnn_128x32_sliced1x4_ldg4_relu_exp_medium_nhwc_tn_v1
[TensorRT] VERBOSE: --------------- Timing Runner: (Unnamed Layer* 13) [Convolution] || (Unnamed Layer* 17) [Convolution] (FusedConvActConvolution)
[TensorRT] VERBOSE: FusedConvActConvolution has no valid tactics for this config, skipping
[TensorRT] VERBOSE: --------------- Timing Runner: (Unnamed Layer* 13) [Convolution] || (Unnamed Layer* 17) [Convolution] (CaskConvolution)
[TensorRT] VERBOSE: (Unnamed Layer* 13) [Convolution] || (Unnamed Layer* 17) [Convolution] (scudnn) Set Tactic Name: volta_scudnn_128x128_relu_exp_medium_nhwc_tn_v1
[TensorRT] VERBOSE: Tactic: 861694390046228376 time 0.0568
[TensorRT] VERBOSE: (Unnamed Layer* 13) [Convolution] || (Unnamed Layer* 17) [Convolution] (scudnn) Set Tactic Name: volta_scudnn_128x64_sliced1x2_ldg4_relu_exp_small_nhwc_tn_v1
[TensorRT] VERBOSE: Tactic: 5258189349241541167 time 0.038272
[TensorRT] VERBOSE: (Unnamed Layer* 13) [Convolution] || (Unnamed Layer* 17) [Convolution] (scudnn) Set Tactic Name: volta_scudnn_128x128_relu_exp_small_nhwc_tn_v1
[TensorRT] VERBOSE: Tactic: 5821621277990374316 time 0.057344
[TensorRT] VERBOSE: (Unnamed Layer* 13) [Convolution] || (Unnamed Layer* 17) [Convolution] (scudnn) Set Tactic Name: volta_scudnn_128x32_sliced1x4_ldg4_relu_exp_small_nhwc_tn_v1
[TensorRT] VERBOSE: Tactic: 5863767799113001648 time 0.063232
[TensorRT] VERBOSE: (Unnamed Layer* 13) [Convolution] || (Unnamed Layer* 17) [Convolution] (scudnn) Set Tactic Name: volta_scudnn_128x128_ldg4_relu_exp_medium_nhwc_tn_v1
[TensorRT] VERBOSE: Tactic: -9147980667639709536 time 0.056448
[TensorRT] VERBOSE: (Unnamed Layer* 13) [Convolution] || (Unnamed Layer* 17) [Convolution] (scudnn) Set Tactic Name: volta_scudnn_128x128_ldg4_relu_exp_interior_nhwc_tn_v1
[TensorRT] VERBOSE: Tactic: -8892196987859366827 time 0.055296
[TensorRT] VERBOSE: (Unnamed Layer* 13) [Convolution] || (Unnamed Layer* 17) [Convolution] (scudnn) Set Tactic Name: volta_scudnn_128x64_sliced1x2_ldg4_relu_exp_medium_nhwc_tn_v1
[TensorRT] VERBOSE: Tactic: -8850904373104590857 time 0.038912
[TensorRT] VERBOSE: (Unnamed Layer* 13) [Convolution] || (Unnamed Layer* 17) [Convolution] (scudnn) Set Tactic Name: volta_scudnn_128x32_sliced1x4_ldg4_relu_exp_interior_nhwc_tn_v1
[TensorRT] VERBOSE: Tactic: -8010679767156598961 time 0.061856
[TensorRT] VERBOSE: (Unnamed Layer* 13) [Convolution] || (Unnamed Layer* 17) [Convolution] (scudnn) Set Tactic Name: volta_scudnn_128x128_ldg4_relu_exp_small_nhwc_tn_v1
[TensorRT] VERBOSE: Tactic: -7751035352149795660 time 0.055584
[TensorRT] VERBOSE: (Unnamed Layer* 13) [Convolution] || (Unnamed Layer* 17) [Convolution] (scudnn) Set Tactic Name: volta_scudnn_128x128_relu_exp_interior_nhwc_tn_v1
[TensorRT] VERBOSE: Tactic: -5115676123557684531 time 0.055744
[TensorRT] VERBOSE: (Unnamed Layer* 13) [Convolution] || (Unnamed Layer* 17) [Convolution] (scudnn) Set Tactic Name: volta_scudnn_128x64_sliced1x2_ldg4_relu_exp_interior_nhwc_tn_v1
[TensorRT] VERBOSE: Tactic: -493597327599791285 time 0.038912
[TensorRT] VERBOSE: (Unnamed Layer* 13) [Convolution] || (Unnamed Layer* 17) [Convolution] (scudnn) Set Tactic Name: volta_scudnn_128x32_sliced1x4_ldg4_relu_exp_medium_nhwc_tn_v1
[TensorRT] VERBOSE: Tactic: -423878181466897819 time 0.063168
[TensorRT] VERBOSE: Fastest Tactic: 5258189349241541167 Time: 0.038272
[TensorRT] VERBOSE: --------------- Timing Runner: (Unnamed Layer* 13) [Convolution] || (Unnamed Layer* 17) [Convolution] (CudaConvolution)
[TensorRT] VERBOSE: CudaConvolution has no valid tactics for this config, skipping
[TensorRT] VERBOSE: --------------- Timing Runner: (Unnamed Layer* 13) [Convolution] || (Unnamed Layer* 17) [Convolution] (CudaDepthwiseConvolution)
[TensorRT] VERBOSE: CudaDepthwiseConvolution has no valid tactics for this config, skipping
[TensorRT] VERBOSE: --------------- Timing Runner: (Unnamed Layer* 13) [Convolution] || (Unnamed Layer* 17) [Convolution] (CublasConvolution)
[TensorRT] VERBOSE: CublasConvolution has no valid tactics for this config, skipping
[TensorRT] VERBOSE: >>>>>>>>>>>>>>> Chose Runner Type: CaskConvolution Tactic: 5258189349241541167
[TensorRT] VERBOSE: (Unnamed Layer* 13) [Convolution] || (Unnamed Layer* 17) [Convolution] (scudnn) Set Tactic Name: volta_scudnn_128x64_sliced1x2_ldg4_relu_exp_small_nhwc_tn_v1
[TensorRT] VERBOSE: 
[TensorRT] VERBOSE: (Unnamed Layer* 13) [Convolution] || (Unnamed Layer* 17) [Convolution] (scudnn) Set Tactic Name: volta_scudnn_128x128_relu_exp_medium_nhwc_tn_v1
[TensorRT] VERBOSE: (Unnamed Layer* 13) [Convolution] || (Unnamed Layer* 17) [Convolution] (scudnn) Set Tactic Name: volta_scudnn_128x64_sliced1x2_ldg4_relu_exp_small_nhwc_tn_v1
[TensorRT] VERBOSE: (Unnamed Layer* 13) [Convolution] || (Unnamed Layer* 17) [Convolution] (scudnn) Set Tactic Name: volta_scudnn_128x128_relu_exp_small_nhwc_tn_v1
[TensorRT] VERBOSE: (Unnamed Layer* 13) [Convolution] || (Unnamed Layer* 17) [Convolution] (scudnn) Set Tactic Name: volta_scudnn_128x32_sliced1x4_ldg4_relu_exp_small_nhwc_tn_v1
[TensorRT] VERBOSE: (Unnamed Layer* 13) [Convolution] || (Unnamed Layer* 17) [Convolution] (scudnn) Set Tactic Name: volta_scudnn_128x128_ldg4_relu_exp_medium_nhwc_tn_v1
[TensorRT] VERBOSE: (Unnamed Layer* 13) [Convolution] || (Unnamed Layer* 17) [Convolution] (scudnn) Set Tactic Name: volta_scudnn_128x128_ldg4_relu_exp_interior_nhwc_tn_v1
[TensorRT] VERBOSE: (Unnamed Layer* 13) [Convolution] || (Unnamed Layer* 17) [Convolution] (scudnn) Set Tactic Name: volta_scudnn_128x64_sliced1x2_ldg4_relu_exp_medium_nhwc_tn_v1
[TensorRT] VERBOSE: (Unnamed Layer* 13) [Convolution] || (Unnamed Layer* 17) [Convolution] (scudnn) Set Tactic Name: volta_scudnn_128x32_sliced1x4_ldg4_relu_exp_interior_nhwc_tn_v1
[TensorRT] VERBOSE: (Unnamed Layer* 13) [Convolution] || (Unnamed Layer* 17) [Convolution] (scudnn) Set Tactic Name: volta_scudnn_128x128_ldg4_relu_exp_small_nhwc_tn_v1
[TensorRT] VERBOSE: (Unnamed Layer* 13) [Convolution] || (Unnamed Layer* 17) [Convolution] (scudnn) Set Tactic Name: volta_scudnn_128x128_relu_exp_interior_nhwc_tn_v1
[TensorRT] VERBOSE: (Unnamed Layer* 13) [Convolution] || (Unnamed Layer* 17) [Convolution] (scudnn) Set Tactic Name: volta_scudnn_128x64_sliced1x2_ldg4_relu_exp_interior_nhwc_tn_v1
[TensorRT] VERBOSE: (Unnamed Layer* 13) [Convolution] || (Unnamed Layer* 17) [Convolution] (scudnn) Set Tactic Name: volta_scudnn_128x32_sliced1x4_ldg4_relu_exp_medium_nhwc_tn_v1
[TensorRT] VERBOSE: (Unnamed Layer* 13) [Convolution] || (Unnamed Layer* 17) [Convolution] (scudnn) Set Tactic Name: volta_scudnn_128x64_sliced1x2_ldg4_relu_exp_small_nhwc_tn_v1
[TensorRT] VERBOSE: --------------- Timing Runner: <reformat> (Reformat)
[TensorRT] VERBOSE: Tactic: 1002 time 0.03072
[TensorRT] VERBOSE: Tactic: 0 time 0.0456
[TensorRT] VERBOSE: Fastest Tactic: 1002 Time: 0.03072
[TensorRT] VERBOSE: --------------- Timing Runner: <reformat> (Reformat)
[TensorRT] VERBOSE: Tactic: 1002 time 0.041408
[TensorRT] VERBOSE: Tactic: 0 time 0.089824
[TensorRT] VERBOSE: Fastest Tactic: 1002 Time: 0.041408
[TensorRT] VERBOSE: --------------- Timing Runner: <reformat> (Reformat)
[TensorRT] VERBOSE: Tactic: 1002 time 0.0312
[TensorRT] VERBOSE: Tactic: 0 time 0.055744
[TensorRT] VERBOSE: Fastest Tactic: 1002 Time: 0.0312
[TensorRT] VERBOSE: --------------- Timing Runner: <reformat> (Reformat)
[TensorRT] VERBOSE: Tactic: 1002 time 0.053696
[TensorRT] VERBOSE: Tactic: 0 time 0.178176
[TensorRT] VERBOSE: Fastest Tactic: 1002 Time: 0.053696
[TensorRT] VERBOSE: --------------- Timing Runner: <reformat> (Reformat)
[TensorRT] VERBOSE: Tactic: 1002 time 0.01616
[TensorRT] VERBOSE: Tactic: 0 time 0.025024
[TensorRT] VERBOSE: Fastest Tactic: 1002 Time: 0.01616
[TensorRT] VERBOSE: --------------- Timing Runner: <reformat> (Reformat)
[TensorRT] VERBOSE: Tactic: 1002 time 0.023168
[TensorRT] VERBOSE: Tactic: 0 time 0.04656
[TensorRT] VERBOSE: Fastest Tactic: 1002 Time: 0.023168
[TensorRT] VERBOSE: --------------- Timing Runner: <reformat> (Reformat)
[TensorRT] VERBOSE: Tactic: 1002 time 0.016096
[TensorRT] VERBOSE: Tactic: 0 time 0.026624
[TensorRT] VERBOSE: Fastest Tactic: 1002 Time: 0.016096
[TensorRT] VERBOSE: --------------- Timing Runner: <reformat> (Reformat)
[TensorRT] VERBOSE: Tactic: 1002 time 0.028672
[TensorRT] VERBOSE: Tactic: 0 time 0.084448
[TensorRT] VERBOSE: Fastest Tactic: 1002 Time: 0.028672
[TensorRT] VERBOSE: --------------- Timing Runner: <reformat> (Reformat)
[TensorRT] VERBOSE: Tactic: 1002 time 0.032768
[TensorRT] VERBOSE: Tactic: 0 time 0.026624
[TensorRT] VERBOSE: Fastest Tactic: 0 Time: 0.026624
[TensorRT] VERBOSE: --------------- Timing Runner: <reformat> (Reformat)
[TensorRT] VERBOSE: Tactic: 1002 time 0.030656
[TensorRT] VERBOSE: Tactic: 0 time 0.018432
[TensorRT] VERBOSE: Fastest Tactic: 0 Time: 0.018432
[TensorRT] VERBOSE: *************** Autotuning format combination: Float(1,160,25600,1638400) -> Float(1,160,25600,819200) ***************
[TensorRT] VERBOSE: --------------- Timing Runner: PWN((Unnamed Layer* 15) [Activation], (Unnamed Layer* 16) [ElementWise]) (PointWise)
[TensorRT] VERBOSE: Tactic: 128 time 0.026944
[TensorRT] VERBOSE: Tactic: 256 time 0.027104
[TensorRT] VERBOSE: Tactic: 512 time 0.029184
[TensorRT] VERBOSE: Tactic: -32 time 0.039232
[TensorRT] VERBOSE: Tactic: -64 time 0.027104
[TensorRT] VERBOSE: Tactic: -128 time 0.026688
[TensorRT] VERBOSE: Fastest Tactic: -128 Time: 0.026688
[TensorRT] VERBOSE: --------------- Timing Runner: PWN((Unnamed Layer* 15) [Activation], (Unnamed Layer* 16) [ElementWise]) (PointWiseV2)
[TensorRT] VERBOSE: Tactic: 0 time 0.016768
[TensorRT] VERBOSE: Tactic: 1 time 0.016096
[TensorRT] VERBOSE: Tactic: 2 time 0.014336
[TensorRT] VERBOSE: Tactic: 3 time 0.014592
[TensorRT] VERBOSE: Tactic: 4 time 0.012992
[TensorRT] VERBOSE: Tactic: 5 time 0.012448
[TensorRT] VERBOSE: Tactic: 6 time 0.014592
[TensorRT] VERBOSE: Tactic: 7 time 0.014336
[TensorRT] VERBOSE: Tactic: 8 time 0.012736
[TensorRT] VERBOSE: Tactic: 9 time 0.010144
[TensorRT] VERBOSE: Tactic: 28 time 0.016448
[TensorRT] VERBOSE: Fastest Tactic: 9 Time: 0.010144
[TensorRT] VERBOSE: >>>>>>>>>>>>>>> Chose Runner Type: PointWiseV2 Tactic: 9
[TensorRT] VERBOSE: 
[TensorRT] VERBOSE: *************** Autotuning format combination: Float(64,10240,1,1638400) -> Float(32,5120,1,819200) ***************
[TensorRT] VERBOSE: --------------- Timing Runner: PWN((Unnamed Layer* 15) [Activation], (Unnamed Layer* 16) [ElementWise]) (PointWise)
[TensorRT] VERBOSE: Tactic: 128 time 0.026624
[TensorRT] VERBOSE: Tactic: 256 time 0.027104
[TensorRT] VERBOSE: Tactic: 512 time 0.030688
[TensorRT] VERBOSE: Tactic: -32 time 0.044576
[TensorRT] VERBOSE: Tactic: -64 time 0.044544
[TensorRT] VERBOSE: Tactic: -128 time 0.045056
[TensorRT] VERBOSE: Fastest Tactic: 128 Time: 0.026624
[TensorRT] VERBOSE: --------------- Timing Runner: PWN((Unnamed Layer* 15) [Activation], (Unnamed Layer* 16) [ElementWise]) (PointWiseV2)
[TensorRT] VERBOSE: PointWiseV2 has no valid tactics for this config, skipping
[TensorRT] VERBOSE: >>>>>>>>>>>>>>> Chose Runner Type: PointWise Tactic: 128
[TensorRT] VERBOSE: 
[TensorRT] VERBOSE: *************** Autotuning format combination: Float(1,160,25600:32,51200) -> Float(1,160,25600:32,25600) ***************
[TensorRT] VERBOSE: --------------- Timing Runner: PWN((Unnamed Layer* 15) [Activation], (Unnamed Layer* 16) [ElementWise]) (PointWise)
[TensorRT] VERBOSE: Tactic: 128 time 0.026624
[TensorRT] VERBOSE: Tactic: 256 time 0.026624
[TensorRT] VERBOSE: Tactic: 512 time 0.029152
[TensorRT] VERBOSE: Tactic: -32 time 0.039136
[TensorRT] VERBOSE: Tactic: -64 time 0.027104
[TensorRT] VERBOSE: Tactic: -128 time 0.026624
[TensorRT] VERBOSE: Fastest Tactic: 128 Time: 0.026624
[TensorRT] VERBOSE: --------------- Timing Runner: PWN((Unnamed Layer* 15) [Activation], (Unnamed Layer* 16) [ElementWise]) (PointWiseV2)
[TensorRT] VERBOSE: Tactic: 24 time 0.016
[TensorRT] VERBOSE: Tactic: 25 time 0.01648
[TensorRT] VERBOSE: Tactic: 26 time 0.014336
[TensorRT] VERBOSE: Tactic: 27 time 0.01568
[TensorRT] VERBOSE: Tactic: 31 time 0.0136
[TensorRT] VERBOSE: Fastest Tactic: 31 Time: 0.0136
[TensorRT] VERBOSE: >>>>>>>>>>>>>>> Chose Runner Type: PointWiseV2 Tactic: 31
[TensorRT] VERBOSE: 
[TensorRT] VERBOSE: --------------- Timing Runner: <reformat> (Reformat)
[TensorRT] VERBOSE: Tactic: 1002 time 0.016032
[TensorRT] VERBOSE: Tactic: 0 time 0.024576
[TensorRT] VERBOSE: Fastest Tactic: 1002 Time: 0.016032
[TensorRT] VERBOSE: --------------- Timing Runner: <reformat> (Reformat)
[TensorRT] VERBOSE: Tactic: 1002 time 0.023008
[TensorRT] VERBOSE: Tactic: 0 time 0.045536
[TensorRT] VERBOSE: Fastest Tactic: 1002 Time: 0.023008
[TensorRT] VERBOSE: --------------- Timing Runner: <reformat> (Reformat)
[TensorRT] VERBOSE: Tactic: 1002 time 0.014848
[TensorRT] VERBOSE: Tactic: 0 time 0.026432
[TensorRT] VERBOSE: Fastest Tactic: 1002 Time: 0.014848
[TensorRT] VERBOSE: --------------- Timing Runner: <reformat> (Reformat)
[TensorRT] VERBOSE: Tactic: 1002 time 0.02912
